{
  "schema_version": 1,
  "figure_id": "PKG05",
  "renderer": "package_style",
  "input": {
    "path": "PKG05.tsv",
    "sha256": "8246b762884cc2991dfc1237cd424e305b92c56bdc1ed7644f09b2912926238e"
  },
  "parameters": {
    "view": "nes",
    "contract": {
      "synthetic": true,
      "source_definition": "Original deterministic display fixtures; no scientific engine executed",
      "independent_unit": "No biological replicates; software display geometry only",
      "denominator": "Complete selected synthetic display grid or universe; explicit per-view channels",
      "value_definition": "Frozen illustrative effects, scores, probabilities, curves, coordinates and topology",
      "uncertainty_definition": "Supplied illustrative intervals only; no inference or interval estimation"
    },
    "options": {
      "pathway_order": [
        "Interferon response",
        "Oxidative metabolism",
        "Matrix organization",
        "RNA processing",
        "Cell cycle",
        "Vesicle transport",
        "DNA repair",
        "Lipid metabolism"
      ],
      "contrast_order": [
        "B versus A",
        "C versus A",
        "D versus A",
        "E versus A"
      ],
      "nes_limits": [
        -2,
        2
      ],
      "size_max": 80,
      "title": "Enrichment across contrasts"
    }
  },
  "theme": {
    "schema_version": 1,
    "project_id": "synthetic-package-PKG05",
    "palette_name": "package_editorial",
    "palette_colors": [
      "#218C8D",
      "#D8795B",
      "#5676A5",
      "#A795BD",
      "#C8A34E",
      "#6EA98C",
      "#B66C87",
      "#7B94A1",
      "#A28C77",
      "#74798D"
    ],
    "group_slots": {
      "Interferon response": 0,
      "Oxidative metabolism": 1,
      "Matrix organization": 2,
      "RNA processing": 3,
      "Cell cycle": 4,
      "Vesicle transport": 5,
      "DNA repair": 6,
      "Lipid metabolism": 7
    },
    "roles": {
      "primary": "#218C8D",
      "negative": "#218C8D",
      "positive": "#74798D",
      "accent": "#74798D",
      "neutral": "#A8ADB3",
      "significant": "#74798D",
      "border": "#526272"
    },
    "continuous": {
      "sequential": [
        "#E2EFEB",
        "#6DB3A7",
        "#1C6C70"
      ],
      "diverging": [
        "#327D9F",
        "#F7F7F4",
        "#D8795B"
      ]
    },
    "continuous_provenance": "Explicit original semantic extensions from selected base card; not an author-provided scale",
    "font_family": "DejaVu Sans",
    "design": {
      "label_pt": 10,
      "tick_pt": 9,
      "title_pt": 11,
      "note_pt": 8,
      "spine_width": 0.7,
      "spine_mode": "keep",
      "grid": "keep"
    },
    "line_width": 1.4,
    "point_edge_width": 0.4,
    "preview_only": true
  },
  "provenance": {
    "experimental_unit": "Synthetic display fixture only; not biological evidence",
    "limits": "Synthetic display fixture only; not biological evidence",
    "input_unit": "Synthetic display fixture only; not biological evidence",
    "uncertainty": "Synthetic display fixture only; not biological evidence",
    "filtering": "Synthetic display fixture only; not biological evidence",
    "interpretation_limit": "Synthetic display fixture only; not biological evidence",
    "contrast": "Illustrative software display",
    "model": "Synthetic display fixture only; not biological evidence",
    "source": "Original deterministic display fixtures; no scientific engine executed",
    "synthetic": true,
    "denominator": "Synthetic display fixture only; not biological evidence"
  },
  "appearance": {
    "preset": "paper"
  }
}
