{
  "schema_version": 1,
  "figure_id": "PKG13",
  "renderer": "package_style",
  "input": {
    "path": "PKG13.tsv",
    "sha256": "4b49da7a7e862eb283af660d9a5efc01fae8da82cfa48da17c0ed027d674edc8"
  },
  "parameters": {
    "view": "volcano",
    "contract": {
      "synthetic": true,
      "source_definition": "Original deterministic display fixtures; no scientific engine executed",
      "independent_unit": "No biological replicates; software display geometry only",
      "denominator": "Complete selected synthetic display grid or universe; explicit per-view channels",
      "value_definition": "Frozen illustrative effects, scores, probabilities, curves, coordinates and topology",
      "uncertainty_definition": "Supplied illustrative intervals only; no inference or interval estimation"
    },
    "options": {
      "title": "Transcriptome response",
      "subtitle": "Illustrative DESeq2 result export / condition B versus A",
      "label_genes": [
        "STAT1",
        "ISG15",
        "IRF7",
        "COX5A",
        "NDUFA1"
      ],
      "effect_cutoff": 1,
      "alpha": 0.05
    }
  },
  "theme": {
    "schema_version": 1,
    "project_id": "synthetic-package-PKG13",
    "palette_name": "package_editorial",
    "palette_colors": [
      "#218C8D",
      "#D8795B",
      "#5676A5",
      "#A795BD",
      "#C8A34E",
      "#6EA98C",
      "#B66C87",
      "#7B94A1",
      "#A28C77",
      "#74798D"
    ],
    "group_slots": {
      "Display": 0
    },
    "roles": {
      "primary": "#218C8D",
      "negative": "#218C8D",
      "positive": "#74798D",
      "accent": "#74798D",
      "neutral": "#A8ADB3",
      "significant": "#74798D",
      "border": "#526272"
    },
    "continuous": {
      "sequential": [
        "#E2EFEB",
        "#6DB3A7",
        "#1C6C70"
      ],
      "diverging": [
        "#327D9F",
        "#F7F7F4",
        "#D8795B"
      ]
    },
    "continuous_provenance": "Explicit original semantic extensions from selected base card; not an author-provided scale",
    "font_family": "DejaVu Sans",
    "design": {
      "label_pt": 10,
      "tick_pt": 9,
      "title_pt": 11,
      "note_pt": 8,
      "spine_width": 0.7,
      "spine_mode": "keep",
      "grid": "keep"
    },
    "line_width": 1.4,
    "point_edge_width": 0.4,
    "preview_only": true
  },
  "provenance": {
    "experimental_unit": "Synthetic display fixture only; not biological evidence",
    "limits": "Synthetic display fixture only; not biological evidence",
    "input_unit": "Synthetic display fixture only; not biological evidence",
    "uncertainty": "Synthetic display fixture only; not biological evidence",
    "filtering": "Synthetic display fixture only; not biological evidence",
    "interpretation_limit": "Synthetic display fixture only; not biological evidence",
    "contrast": "Illustrative DESeq2 result export / condition B versus A",
    "model": "Synthetic display fixture only; not biological evidence",
    "source": "Original deterministic display fixtures; no scientific engine executed",
    "synthetic": true,
    "denominator": "Synthetic display fixture only; not biological evidence"
  },
  "appearance": {
    "preset": "paper"
  }
}
